{
  "id": "bike-07-go",
  "approved": true,
  "theme": "bikes",
  "title": "Go Ride",
  "target_words": [
    "go",
    "ride"
  ],
  "scene": {
    "setting": "A sunny start line for riding",
    "image": "assets/scenes/go-start.png",
    "character": "bunny",
    "video": "assets/videos/tudouqiche.mp4",
    "video_max_seconds": 5
  },
  "beats": [
    {
      "type": "introduce",
      "show": "assets/items/bike.png",
      "npc_say": "Ready… set…",
      "hint_say": "Ready!"
    },
    {
      "type": "ask",
      "show": "assets/items/bike.png",
      "npc_say": "Say go!",
      "expect": [
        "go",
        "let's go"
      ],
      "hint_say": "Go!",
      "success_say": "Go go go!",
      "fallback": {
        "type": "picture_choice",
        "options": [
          {
            "id": "bike",
            "image": "assets/items/bike.png",
            "correct": true
          },
          {
            "id": "helmet",
            "image": "assets/items/helmet.png",
            "correct": false
          }
        ]
      }
    },
    {
      "type": "ask",
      "show": "assets/items/rider-kid.png",
      "npc_say": "Can you ride? Say ride!",
      "expect": [
        "ride",
        "go"
      ],
      "hint_say": "Ride!",
      "success_say": "Zoom!",
      "fallback": {
        "type": "picture_choice",
        "options": [
          {
            "id": "rider",
            "image": "assets/items/rider-kid.png",
            "correct": true
          },
          {
            "id": "bell",
            "image": "assets/items/bell.png",
            "correct": false
          }
        ]
      }
    },
    {
      "type": "introduce",
      "show": "assets/items/rider-kid.png",
      "npc_say": "Yay! Go!"
    }
  ],
  "reward": {
    "sticker": "sticker-rider-kid",
    "stickerImage": "assets/items/rider-kid.png",
    "stars": 1
  },
  "beep_talk": {
    "start": "w1",
    "nodes": {
      "w1": {
        "robot_say": "Beep! What is it?",
        "expect": [
          "go",
          "a go",
          "the go"
        ],
        "hint_say": "Say go!",
        "success_say": "Yes! Go!",
        "show": "assets/items/rider-kid.png",
        "next": "w2",
        "on_fail_next": "w2",
        "fallback": {
          "type": "picture_choice",
          "options": [
            {
              "id": "yes",
              "image": "assets/items/rider-kid.png",
              "correct": true
            },
            {
              "id": "no",
              "image": "assets/items/bike.png",
              "correct": false
            }
          ]
        }
      },
      "w2": {
        "robot_say": "Beep! What is it?",
        "expect": [
          "ride",
          "a ride",
          "the ride"
        ],
        "hint_say": "Say ride!",
        "success_say": "Yes! Ride!",
        "show": "assets/items/rider-kid.png",
        "next": "bye",
        "on_fail_next": "bye",
        "fallback": {
          "type": "picture_choice",
          "options": [
            {
              "id": "yes",
              "image": "assets/items/rider-kid.png",
              "correct": true
            },
            {
              "id": "no",
              "image": "assets/items/helmet.png",
              "correct": false
            }
          ]
        }
      },
      "bye": {
        "robot_say": "Bye-bye, go friend!",
        "expect": [
          "bye",
          "bye bye",
          "goodbye",
          "bye-bye"
        ],
        "hint_say": "Say bye!",
        "success_say": "Beep! Bye-bye!",
        "show": "assets/items/rider-kid.png",
        "next": null,
        "on_fail_next": null,
        "fallback": {
          "type": "picture_choice",
          "options": [
            {
              "id": "yes",
              "image": "assets/items/rider-kid.png",
              "correct": true
            },
            {
              "id": "no",
              "image": "assets/items/bell.png",
              "correct": false
            }
          ]
        }
      }
    }
  }
}
