{
  "id": "swim-05-kick",
  "approved": true,
  "theme": "swimming",
  "title": "Kick",
  "target_words": [
    "kick"
  ],
  "scene": {
    "setting": "Bunny kicks in the shallow pool",
    "image": "assets/scenes/stroke-lanes.png",
    "character": "bunny"
  },
  "beats": [
    {
      "type": "introduce",
      "show": "assets/items/kick.png",
      "npc_say": "Kick, kick! Splash!",
      "hint_say": "Kick!"
    },
    {
      "type": "find",
      "npc_say": "Find kick!",
      "hint_say": "Kick!",
      "success_say": "Yes! Kick!",
      "options": [
        {
          "id": "kick",
          "image": "assets/items/kick.png",
          "correct": true
        },
        {
          "id": "ring",
          "image": "assets/items/swimring.png",
          "correct": false
        }
      ]
    },
    {
      "type": "ask",
      "show": "assets/items/kick.png",
      "npc_say": "What do your legs do?",
      "expect": [
        "kick",
        "a kick",
        "kicking",
        "kick kick"
      ],
      "hint_say": "Kick!",
      "success_say": "Great kick!",
      "fallback": {
        "type": "picture_choice",
        "options": [
          {
            "id": "kick",
            "image": "assets/items/kick.png",
            "correct": true
          },
          {
            "id": "cap",
            "image": "assets/items/swimcap.png",
            "correct": false
          }
        ]
      }
    },
    {
      "type": "introduce",
      "show": "assets/items/kick.png",
      "npc_say": "Kick! Yay!"
    }
  ],
  "reward": {
    "sticker": "sticker-kick",
    "stickerImage": "assets/items/kick.png",
    "stars": 1
  },
  "beep_talk": {
    "start": "what",
    "nodes": {
      "what": {
        "robot_say": "Beep! What is it?",
        "expect": [
          "kick",
          "a kick",
          "the kick",
          "kicking"
        ],
        "hint_say": "Say kick!",
        "success_say": "Yes! Kick!",
        "show": "assets/items/kick.png",
        "next": "again",
        "on_fail_next": "again",
        "fallback": {
          "type": "picture_choice",
          "options": [
            {
              "id": "yes",
              "image": "assets/items/kick.png",
              "correct": true
            },
            {
              "id": "no",
              "image": "assets/items/swimring.png",
              "correct": false
            }
          ]
        }
      },
      "again": {
        "robot_say": "Can you say kick?",
        "expect": [
          "kick",
          "a kick",
          "the kick",
          "kicking"
        ],
        "hint_say": "Say kick!",
        "success_say": "Great kick!",
        "show": "assets/items/kick.png",
        "next": "bye",
        "on_fail_next": "bye",
        "fallback": {
          "type": "picture_choice",
          "options": [
            {
              "id": "yes",
              "image": "assets/items/kick.png",
              "correct": true
            },
            {
              "id": "no",
              "image": "assets/items/goggles.png",
              "correct": false
            }
          ]
        }
      },
      "bye": {
        "robot_say": "Bye-bye, kick friend!",
        "expect": [
          "bye",
          "bye bye",
          "goodbye",
          "bye-bye"
        ],
        "hint_say": "Say bye!",
        "success_say": "Beep! Bye-bye!",
        "show": "assets/items/kick.png",
        "next": null,
        "on_fail_next": null,
        "fallback": {
          "type": "picture_choice",
          "options": [
            {
              "id": "yes",
              "image": "assets/items/kick.png",
              "correct": true
            },
            {
              "id": "no",
              "image": "assets/items/apple.png",
              "correct": false
            }
          ]
        }
      }
    }
  }
}
