{
  "id": "bike-01-bike",
  "approved": true,
  "theme": "bikes",
  "title": "Bike Garage",
  "target_words": [
    "bike"
  ],
  "scene": {
    "setting": "A sunny bike garage",
    "image": "assets/scenes/bike-garage.png",
    "character": "bunny"
  },
  "beats": [
    {
      "type": "introduce",
      "show": "assets/items/bike.png",
      "npc_say": "Vroom? No… two wheels!",
      "hint_say": "Wheels!"
    },
    {
      "type": "ask",
      "show": "assets/items/bike.png",
      "npc_say": "What can we ride?",
      "expect": [
        "bike",
        "a bike"
      ],
      "hint_say": "Bike!",
      "success_say": "Yes! Bike!",
      "fallback": {
        "type": "picture_choice",
        "options": [
          {
            "id": "bike",
            "image": "assets/items/bike.png",
            "correct": true
          },
          {
            "id": "tricycle",
            "image": "assets/items/tricycle.png",
            "correct": false
          }
        ]
      }
    },
    {
      "type": "ask",
      "show": "assets/items/bike.png",
      "npc_say": "Can you say bike?",
      "expect": [
        "bike",
        "a bike"
      ],
      "hint_say": "Bike!",
      "success_say": "Cool!",
      "fallback": {
        "type": "picture_choice",
        "options": [
          {
            "id": "bike",
            "image": "assets/items/bike.png",
            "correct": true
          },
          {
            "id": "helmet",
            "image": "assets/items/helmet.png",
            "correct": false
          }
        ]
      }
    },
    {
      "type": "introduce",
      "show": "assets/items/bike.png",
      "npc_say": "Nice bike!"
    }
  ],
  "reward": {
    "sticker": "sticker-bike",
    "stickerImage": "assets/items/bike.png",
    "stars": 1
  }
}
