{
  "id": "fruit-02-banana",
  "approved": true,
  "theme": "fruits",
  "title": "Banana Grove",
  "target_words": [
    "banana"
  ],
  "scene": {
    "setting": "A tropical banana grove",
    "image": "assets/scenes/banana-grove.png",
    "character": "bunny"
  },
  "beats": [
    {
      "type": "introduce",
      "show": "assets/items/banana.png",
      "npc_say": "Yellow and long!",
      "hint_say": "Yellow!"
    },
    {
      "type": "ask",
      "show": "assets/items/banana.png",
      "npc_say": "Help Bunny! What is it?",
      "expect": [
        "banana",
        "a banana"
      ],
      "hint_say": "Banana!",
      "success_say": "Wow! Banana!",
      "fallback": {
        "type": "picture_choice",
        "options": [
          {
            "id": "banana",
            "image": "assets/items/banana.png",
            "correct": true
          },
          {
            "id": "apple",
            "image": "assets/items/apple.png",
            "correct": false
          }
        ]
      }
    },
    {
      "type": "ask",
      "show": "assets/items/banana.png",
      "npc_say": "Can you say banana?",
      "expect": [
        "banana",
        "a banana"
      ],
      "hint_say": "Ba-na-na!",
      "success_say": "Super!",
      "fallback": {
        "type": "picture_choice",
        "options": [
          {
            "id": "banana",
            "image": "assets/items/banana.png",
            "correct": true
          },
          {
            "id": "grape",
            "image": "assets/items/grape.png",
            "correct": false
          }
        ]
      }
    },
    {
      "type": "introduce",
      "show": "assets/items/banana.png",
      "npc_say": "Yay! A banana!"
    }
  ],
  "reward": {
    "sticker": "sticker-banana",
    "stickerImage": "assets/items/banana.png",
    "stars": 1
  },
  "beep_talk": {
    "start": "what",
    "nodes": {
      "what": {
        "robot_say": "Beep! What is it?",
        "expect": [
          "banana",
          "a banana",
          "the banana"
        ],
        "hint_say": "Say banana!",
        "success_say": "Yes! Banana!",
        "show": "assets/items/banana.png",
        "next": "again",
        "on_fail_next": "again",
        "fallback": {
          "type": "picture_choice",
          "options": [
            {
              "id": "yes",
              "image": "assets/items/banana.png",
              "correct": true
            },
            {
              "id": "no",
              "image": "assets/items/apple.png",
              "correct": false
            }
          ]
        }
      },
      "again": {
        "robot_say": "Can you say banana?",
        "expect": [
          "banana",
          "a banana",
          "the banana"
        ],
        "hint_say": "Say banana!",
        "success_say": "Great banana!",
        "show": "assets/items/banana.png",
        "next": "bye",
        "on_fail_next": "bye",
        "fallback": {
          "type": "picture_choice",
          "options": [
            {
              "id": "yes",
              "image": "assets/items/banana.png",
              "correct": true
            },
            {
              "id": "no",
              "image": "assets/items/grape.png",
              "correct": false
            }
          ]
        }
      },
      "bye": {
        "robot_say": "Bye-bye, banana friend!",
        "expect": [
          "bye",
          "bye bye",
          "goodbye",
          "bye-bye"
        ],
        "hint_say": "Say bye!",
        "success_say": "Beep! Bye-bye!",
        "show": "assets/items/banana.png",
        "next": null,
        "on_fail_next": null,
        "fallback": {
          "type": "picture_choice",
          "options": [
            {
              "id": "yes",
              "image": "assets/items/banana.png",
              "correct": true
            },
            {
              "id": "no",
              "image": "assets/items/arm.png",
              "correct": false
            }
          ]
        }
      }
    }
  }
}
