{
  "id": "bike-02-tricycle",
  "approved": true,
  "theme": "bikes",
  "title": "Tricycle Shed",
  "target_words": [
    "tricycle"
  ],
  "scene": {
    "setting": "A friendly tricycle shed",
    "image": "assets/scenes/tricycle-shed.png",
    "character": "bunny"
  },
  "beats": [
    {
      "type": "introduce",
      "show": "assets/items/tricycle.png",
      "npc_say": "One, two, three wheels!",
      "hint_say": "Three!"
    },
    {
      "type": "find",
      "npc_say": "Find the tricycle!",
      "hint_say": "Trike!",
      "success_say": "Yes! Trike!",
      "options": [
        {
          "id": "tricycle",
          "image": "assets/items/tricycle.png",
          "correct": true
        },
        {
          "id": "bike",
          "image": "assets/items/bike.png",
          "correct": false
        }
      ]
    },
    {
      "type": "ask",
      "show": "assets/items/tricycle.png",
      "npc_say": "What is it?",
      "expect": [
        "tricycle",
        "a tricycle",
        "trike",
        "a trike"
      ],
      "hint_say": "Tricycle!",
      "success_say": "Super!",
      "fallback": {
        "type": "picture_choice",
        "options": [
          {
            "id": "tricycle",
            "image": "assets/items/tricycle.png",
            "correct": true
          },
          {
            "id": "road-bike",
            "image": "assets/items/road-bike.png",
            "correct": false
          }
        ]
      }
    },
    {
      "type": "introduce",
      "show": "assets/items/tricycle.png",
      "npc_say": "Yay! A tricycle!"
    }
  ],
  "reward": {
    "sticker": "sticker-tricycle",
    "stickerImage": "assets/items/tricycle.png",
    "stars": 1
  }
}
