{
  "id": "swim-06-water",
  "approved": true,
  "theme": "swimming",
  "title": "Water",
  "target_words": [
    "water"
  ],
  "scene": {
    "setting": "Cool blue water in the pool",
    "image": "assets/scenes/swim-pool.png",
    "character": "bunny"
  },
  "beats": [
    {
      "type": "introduce",
      "show": "assets/items/river.png",
      "npc_say": "Cool water! Splash!",
      "hint_say": "Water!"
    },
    {
      "type": "find",
      "npc_say": "Find the water!",
      "hint_say": "Water!",
      "success_say": "Yes! Water!",
      "options": [
        {
          "id": "water",
          "image": "assets/items/river.png",
          "correct": true
        },
        {
          "id": "cap",
          "image": "assets/items/swimcap.png",
          "correct": false
        }
      ]
    },
    {
      "type": "ask",
      "show": "assets/items/river.png",
      "npc_say": "What do we swim in?",
      "expect": [
        "water",
        "the water",
        "some water"
      ],
      "hint_say": "Water!",
      "success_say": "Cool water!",
      "fallback": {
        "type": "picture_choice",
        "options": [
          {
            "id": "water",
            "image": "assets/items/river.png",
            "correct": true
          },
          {
            "id": "goggles",
            "image": "assets/items/goggles.png",
            "correct": false
          }
        ]
      }
    },
    {
      "type": "introduce",
      "show": "assets/items/river.png",
      "npc_say": "Water! Yay!"
    }
  ],
  "reward": {
    "sticker": "sticker-water",
    "stickerImage": "assets/items/river.png",
    "stars": 1
  },
  "beep_talk": {
    "start": "what",
    "nodes": {
      "what": {
        "robot_say": "Beep! What is it?",
        "expect": [
          "water",
          "the water",
          "some water"
        ],
        "hint_say": "Say water!",
        "success_say": "Yes! Water!",
        "show": "assets/items/river.png",
        "next": "again",
        "on_fail_next": "again",
        "fallback": {
          "type": "picture_choice",
          "options": [
            {
              "id": "yes",
              "image": "assets/items/river.png",
              "correct": true
            },
            {
              "id": "no",
              "image": "assets/items/swimcap.png",
              "correct": false
            }
          ]
        }
      },
      "again": {
        "robot_say": "Can you say water?",
        "expect": [
          "water",
          "the water",
          "some water"
        ],
        "hint_say": "Say water!",
        "success_say": "Great water!",
        "show": "assets/items/river.png",
        "next": "bye",
        "on_fail_next": "bye",
        "fallback": {
          "type": "picture_choice",
          "options": [
            {
              "id": "yes",
              "image": "assets/items/river.png",
              "correct": true
            },
            {
              "id": "no",
              "image": "assets/items/apple.png",
              "correct": false
            }
          ]
        }
      },
      "bye": {
        "robot_say": "Bye-bye, water friend!",
        "expect": [
          "bye",
          "bye bye",
          "goodbye",
          "bye-bye"
        ],
        "hint_say": "Say bye!",
        "success_say": "Beep! Bye-bye!",
        "show": "assets/items/river.png",
        "next": null,
        "on_fail_next": null,
        "fallback": {
          "type": "picture_choice",
          "options": [
            {
              "id": "yes",
              "image": "assets/items/river.png",
              "correct": true
            },
            {
              "id": "no",
              "image": "assets/items/banana.png",
              "correct": false
            }
          ]
        }
      }
    }
  }
}
