{
  "id": "hero-07-go",
  "approved": true,
  "theme": "heroes",
  "title": "Go Launch",
  "target_words": [
    "go"
  ],
  "scene": {
    "setting": "A hero launch pad",
    "image": "assets/scenes/go-launch.png",
    "character": "bunny"
  },
  "beats": [
    {
      "type": "introduce",
      "show": "assets/items/hero.png",
      "npc_say": "Ready… set…",
      "hint_say": "Ready!"
    },
    {
      "type": "find",
      "npc_say": "Find the hero!",
      "hint_say": "Hero!",
      "success_say": "Yes!",
      "options": [
        {
          "id": "hero",
          "image": "assets/items/hero.png",
          "correct": true
        },
        {
          "id": "monster",
          "image": "assets/items/monster.png",
          "correct": false
        }
      ]
    },
    {
      "type": "ask",
      "show": "assets/items/hero.png",
      "npc_say": "Say go!",
      "expect": [
        "go"
      ],
      "hint_say": "Go!",
      "success_say": "Go go go!",
      "fallback": {
        "type": "picture_choice",
        "options": [
          {
            "id": "go",
            "image": "assets/items/hero.png",
            "correct": true
          },
          {
            "id": "shield",
            "image": "assets/items/shield.png",
            "correct": false
          }
        ]
      }
    },
    {
      "type": "introduce",
      "show": "assets/items/hero.png",
      "npc_say": "Let's go!"
    }
  ],
  "reward": {
    "sticker": "sticker-hero-go",
    "stickerImage": "assets/items/hero.png",
    "stars": 1
  },
  "beep_talk": {
    "start": "what",
    "nodes": {
      "what": {
        "robot_say": "Beep! What is it?",
        "expect": [
          "go",
          "a go",
          "the go"
        ],
        "hint_say": "Say go!",
        "success_say": "Yes! Go!",
        "show": "assets/items/hero.png",
        "next": "again",
        "on_fail_next": "again",
        "fallback": {
          "type": "picture_choice",
          "options": [
            {
              "id": "yes",
              "image": "assets/items/hero.png",
              "correct": true
            },
            {
              "id": "no",
              "image": "assets/items/monster.png",
              "correct": false
            }
          ]
        }
      },
      "again": {
        "robot_say": "Can you say go?",
        "expect": [
          "go",
          "a go",
          "the go"
        ],
        "hint_say": "Say go!",
        "success_say": "Great go!",
        "show": "assets/items/hero.png",
        "next": "bye",
        "on_fail_next": "bye",
        "fallback": {
          "type": "picture_choice",
          "options": [
            {
              "id": "yes",
              "image": "assets/items/hero.png",
              "correct": true
            },
            {
              "id": "no",
              "image": "assets/items/shield.png",
              "correct": false
            }
          ]
        }
      },
      "bye": {
        "robot_say": "Bye-bye, go friend!",
        "expect": [
          "bye",
          "bye bye",
          "goodbye",
          "bye-bye"
        ],
        "hint_say": "Say bye!",
        "success_say": "Beep! Bye-bye!",
        "show": "assets/items/hero.png",
        "next": null,
        "on_fail_next": null,
        "fallback": {
          "type": "picture_choice",
          "options": [
            {
              "id": "yes",
              "image": "assets/items/hero.png",
              "correct": true
            },
            {
              "id": "no",
              "image": "assets/items/apple.png",
              "correct": false
            }
          ]
        }
      }
    }
  }
}
