{
  "id": "swim-07-butterfly",
  "approved": true,
  "theme": "swimming",
  "title": "Butterfly",
  "target_words": [
    "butterfly"
  ],
  "scene": {
    "setting": "Swim lanes for learning strokes",
    "image": "assets/scenes/stroke-lanes.png",
    "character": "bunny"
  },
  "beats": [
    {
      "type": "introduce",
      "show": "assets/items/butterfly.png",
      "npc_say": "Both arms! Fly!",
      "hint_say": "Butterfly!"
    },
    {
      "type": "find",
      "npc_say": "Find butterfly!",
      "hint_say": "Butterfly!",
      "success_say": "Yes!",
      "options": [
        {
          "id": "butterfly",
          "image": "assets/items/butterfly.png",
          "correct": true
        },
        {
          "id": "backstroke",
          "image": "assets/items/backstroke.png",
          "correct": false
        }
      ]
    },
    {
      "type": "ask",
      "show": "assets/items/butterfly.png",
      "npc_say": "What stroke is this?",
      "expect": [
        "butterfly",
        "butterfly stroke"
      ],
      "hint_say": "Butterfly!",
      "success_say": "Wow!",
      "fallback": {
        "type": "picture_choice",
        "options": [
          {
            "id": "butterfly",
            "image": "assets/items/butterfly.png",
            "correct": true
          },
          {
            "id": "breaststroke",
            "image": "assets/items/breaststroke.png",
            "correct": false
          }
        ]
      }
    },
    {
      "type": "introduce",
      "show": "assets/items/butterfly.png",
      "npc_say": "Butterfly! Strong!"
    }
  ],
  "reward": {
    "sticker": "sticker-butterfly",
    "stickerImage": "assets/items/butterfly.png",
    "stars": 1
  },
  "beep_talk": {
    "start": "what",
    "nodes": {
      "what": {
        "robot_say": "Beep! What is it?",
        "expect": [
          "butterfly",
          "a butterfly",
          "the butterfly"
        ],
        "hint_say": "Say butterfly!",
        "success_say": "Yes! Butterfly!",
        "show": "assets/items/butterfly.png",
        "next": "again",
        "on_fail_next": "again",
        "fallback": {
          "type": "picture_choice",
          "options": [
            {
              "id": "yes",
              "image": "assets/items/butterfly.png",
              "correct": true
            },
            {
              "id": "no",
              "image": "assets/items/backstroke.png",
              "correct": false
            }
          ]
        }
      },
      "again": {
        "robot_say": "Can you say butterfly?",
        "expect": [
          "butterfly",
          "a butterfly",
          "the butterfly"
        ],
        "hint_say": "Say butterfly!",
        "success_say": "Great butterfly!",
        "show": "assets/items/butterfly.png",
        "next": "bye",
        "on_fail_next": "bye",
        "fallback": {
          "type": "picture_choice",
          "options": [
            {
              "id": "yes",
              "image": "assets/items/butterfly.png",
              "correct": true
            },
            {
              "id": "no",
              "image": "assets/items/breaststroke.png",
              "correct": false
            }
          ]
        }
      },
      "bye": {
        "robot_say": "Bye-bye, butterfly friend!",
        "expect": [
          "bye",
          "bye bye",
          "goodbye",
          "bye-bye"
        ],
        "hint_say": "Say bye!",
        "success_say": "Beep! Bye-bye!",
        "show": "assets/items/butterfly.png",
        "next": null,
        "on_fail_next": null,
        "fallback": {
          "type": "picture_choice",
          "options": [
            {
              "id": "yes",
              "image": "assets/items/butterfly.png",
              "correct": true
            },
            {
              "id": "no",
              "image": "assets/items/apple.png",
              "correct": false
            }
          ]
        }
      }
    }
  }
}
