{
  "id": "bike-04-road",
  "approved": true,
  "theme": "bikes",
  "title": "Road Lane",
  "target_words": [
    "road bike"
  ],
  "scene": {
    "setting": "A smooth road bike lane",
    "image": "assets/scenes/road-lane.png",
    "character": "bunny"
  },
  "beats": [
    {
      "type": "introduce",
      "show": "assets/items/road-bike.png",
      "npc_say": "Fast on the road!",
      "hint_say": "Fast!"
    },
    {
      "type": "ask",
      "show": "assets/items/road-bike.png",
      "npc_say": "Thin wheels! What bike?",
      "expect": [
        "road bike",
        "a road bike",
        "road",
        "bike",
        "a bike",
        "the bike"
      ],
      "hint_say": "Road bike!",
      "success_say": "Cool!",
      "fallback": {
        "type": "picture_choice",
        "options": [
          {
            "id": "road",
            "image": "assets/items/road-bike.png",
            "correct": true
          },
          {
            "id": "mountain",
            "image": "assets/items/mountain-bike.png",
            "correct": false
          }
        ]
      }
    },
    {
      "type": "ask",
      "show": "assets/items/road-bike.png",
      "npc_say": "Can you say road bike?",
      "expect": [
        "road bike",
        "a road bike",
        "road",
        "bike",
        "a bike",
        "the bike"
      ],
      "hint_say": "Road bike!",
      "success_say": "Yes!",
      "fallback": {
        "type": "picture_choice",
        "options": [
          {
            "id": "road",
            "image": "assets/items/road-bike.png",
            "correct": true
          },
          {
            "id": "tricycle",
            "image": "assets/items/tricycle.png",
            "correct": false
          }
        ]
      }
    },
    {
      "type": "introduce",
      "show": "assets/items/road-bike.png",
      "npc_say": "Zoom!"
    }
  ],
  "reward": {
    "sticker": "sticker-road-bike",
    "stickerImage": "assets/items/road-bike.png",
    "stars": 1
  },
  "beep_talk": {
    "start": "what",
    "nodes": {
      "what": {
        "robot_say": "Beep! What is it?",
        "expect": [
          "road bike",
          "road",
          "bike",
          "a road bike",
          "a bike",
          "the bike"
        ],
        "hint_say": "Say road bike!",
        "success_say": "Yes! Road bike!",
        "show": "assets/items/road-bike.png",
        "next": "again",
        "on_fail_next": "again",
        "fallback": {
          "type": "picture_choice",
          "options": [
            {
              "id": "yes",
              "image": "assets/items/road-bike.png",
              "correct": true
            },
            {
              "id": "no",
              "image": "assets/items/mountain-bike.png",
              "correct": false
            }
          ]
        }
      },
      "again": {
        "robot_say": "Can you say road bike?",
        "expect": [
          "road bike",
          "road",
          "bike",
          "a road bike",
          "a bike",
          "the bike"
        ],
        "hint_say": "Say road bike!",
        "success_say": "Great road bike!",
        "show": "assets/items/road-bike.png",
        "next": "bye",
        "on_fail_next": "bye",
        "fallback": {
          "type": "picture_choice",
          "options": [
            {
              "id": "yes",
              "image": "assets/items/road-bike.png",
              "correct": true
            },
            {
              "id": "no",
              "image": "assets/items/tricycle.png",
              "correct": false
            }
          ]
        }
      },
      "bye": {
        "robot_say": "Bye-bye, road bike friend!",
        "expect": [
          "bye",
          "bye bye",
          "goodbye",
          "bye-bye"
        ],
        "hint_say": "Say bye!",
        "success_say": "Beep! Bye-bye!",
        "show": "assets/items/road-bike.png",
        "next": null,
        "on_fail_next": null,
        "fallback": {
          "type": "picture_choice",
          "options": [
            {
              "id": "yes",
              "image": "assets/items/road-bike.png",
              "correct": true
            },
            {
              "id": "no",
              "image": "assets/items/apple.png",
              "correct": false
            }
          ]
        }
      }
    }
  }
}
